{
  "schema_version": "1.0.0",
  "package_id": "swu-tsgr-003-closeout-sync-v1",
  "mutation_mode": "apply-approved",
  "mutation_state": "materialized",
  "lifecycle_owner": "invoke",
  "authority_class": "public",
  "publication_class": "public",
  "source_artifacts": [
    {
      "path": "arcanum/arcana/task-session/development/invoke-runs/20260730T170810Z-deterministic-governance-runner/work-pack/results/SWU-TSGR-003-RESULT.json",
      "sha256": "2499ec19ecc52ddfa5c4e8a2059f6563bd31b71cf22e7e57b97ae68178ec100b",
      "size_bytes": 2680,
      "authority_class": "public"
    },
    {
      "path": "arcanum/arcana/task-session/development/invoke-runs/20260730T170810Z-deterministic-governance-runner/refreshes/20260730T202200Z-swu-tsgr-003-producer/task-session-review/CLOSEOUT-PREFLIGHT.json",
      "sha256": "6d3ce08c8958be58ec6543614f31292fc1e47908e7b8edc2fc783e4f0cd2f56c",
      "size_bytes": 3624,
      "authority_class": "public"
    },
    {
      "path": "arcanum/arcana/task-session/development/invoke-runs/20260730T170810Z-deterministic-governance-runner/work-pack/shared/EXECUTION-CONTROL.md",
      "sha256": "c53787d564040cce543525eb5e13ee26cd13a54cfe8ccc46cbe6cd4230490fe8",
      "size_bytes": 4447,
      "authority_class": "public"
    }
  ],
  "changes": [
    {
      "target_path": "arcanum/arcana/task-session/development/invoke-runs/20260730T170810Z-deterministic-governance-runner/WORK-PACK.md",
      "operation": "update",
      "output_ref": {
        "path": "arcanum/arcana/task-session/development/invoke-runs/20260730T170810Z-deterministic-governance-runner/refreshes/20260730T202200Z-swu-tsgr-003-producer/task-session-apply/closeout/staged/arcanum/arcana/task-session/development/invoke-runs/20260730T170810Z-deterministic-governance-runner/WORK-PACK.md",
        "sha256": "d443f12f04a066484025794d04d4ad2eccc7bbe04d49ead5b3bf799384a672ca",
        "size_bytes": 8970
      }
    },
    {
      "target_path": "arcanum/arcana/task-session/development/invoke-runs/20260730T170810Z-deterministic-governance-runner/work-pack/tasks/TASK-TSGR-02-RUNNER.md",
      "operation": "update",
      "output_ref": {
        "path": "arcanum/arcana/task-session/development/invoke-runs/20260730T170810Z-deterministic-governance-runner/refreshes/20260730T202200Z-swu-tsgr-003-producer/task-session-apply/closeout/staged/arcanum/arcana/task-session/development/invoke-runs/20260730T170810Z-deterministic-governance-runner/work-pack/tasks/TASK-TSGR-02-RUNNER.md",
        "sha256": "b8c2441fd0789749053044b90c71806a8614993e8d3bb5be6b6fce18fa12b643",
        "size_bytes": 2949
      }
    },
    {
      "target_path": "arcanum/arcana/task-session/development/invoke-runs/20260730T170810Z-deterministic-governance-runner/work-pack/waves/W1-RUNNER-MECHANISM.md",
      "operation": "update",
      "output_ref": {
        "path": "arcanum/arcana/task-session/development/invoke-runs/20260730T170810Z-deterministic-governance-runner/refreshes/20260730T202200Z-swu-tsgr-003-producer/task-session-apply/closeout/staged/arcanum/arcana/task-session/development/invoke-runs/20260730T170810Z-deterministic-governance-runner/work-pack/waves/W1-RUNNER-MECHANISM.md",
        "sha256": "8e450555745d71fdcf59f86d7213199a955cb98045b211e8da9f00f5a74c3bb9",
        "size_bytes": 502
      }
    },
    {
      "target_path": "arcanum/arcana/task-session/development/invoke-runs/20260730T170810Z-deterministic-governance-runner/CONTINUATION.json",
      "operation": "update",
      "output_ref": {
        "path": "arcanum/arcana/task-session/development/invoke-runs/20260730T170810Z-deterministic-governance-runner/refreshes/20260730T202200Z-swu-tsgr-003-producer/task-session-apply/closeout/staged/arcanum/arcana/task-session/development/invoke-runs/20260730T170810Z-deterministic-governance-runner/CONTINUATION.json",
        "sha256": "811164c0da315422d2fc9f3a20b799365114c728be0a404116a7cdad143d7035",
        "size_bytes": 1050
      }
    }
  ],
  "target_inventory": [
    {
      "target_path": "arcanum/arcana/task-session/development/invoke-runs/20260730T170810Z-deterministic-governance-runner/WORK-PACK.md",
      "lifecycle_owner": "invoke",
      "authority_class": "public",
      "publication_class": "public",
      "dependency_ids": [
        "swu-tsgr-003-terminal-result",
        "swu-tsgr-003-closeout-preflight"
      ]
    },
    {
      "target_path": "arcanum/arcana/task-session/development/invoke-runs/20260730T170810Z-deterministic-governance-runner/work-pack/tasks/TASK-TSGR-02-RUNNER.md",
      "lifecycle_owner": "invoke",
      "authority_class": "public",
      "publication_class": "public",
      "dependency_ids": [
        "swu-tsgr-003-terminal-result",
        "swu-tsgr-003-closeout-preflight"
      ]
    },
    {
      "target_path": "arcanum/arcana/task-session/development/invoke-runs/20260730T170810Z-deterministic-governance-runner/work-pack/waves/W1-RUNNER-MECHANISM.md",
      "lifecycle_owner": "invoke",
      "authority_class": "public",
      "publication_class": "public",
      "dependency_ids": [
        "swu-tsgr-003-terminal-result",
        "swu-tsgr-003-closeout-preflight"
      ]
    },
    {
      "target_path": "arcanum/arcana/task-session/development/invoke-runs/20260730T170810Z-deterministic-governance-runner/CONTINUATION.json",
      "lifecycle_owner": "invoke",
      "authority_class": "public",
      "publication_class": "public",
      "dependency_ids": [
        "swu-tsgr-003-terminal-result",
        "swu-tsgr-003-closeout-preflight"
      ]
    }
  ],
  "dependencies": [
    {
      "dependency_id": "swu-tsgr-003-terminal-result",
      "artifact_ref": {
        "path": "arcanum/arcana/task-session/development/invoke-runs/20260730T170810Z-deterministic-governance-runner/work-pack/results/SWU-TSGR-003-RESULT.json",
        "sha256": "2499ec19ecc52ddfa5c4e8a2059f6563bd31b71cf22e7e57b97ae68178ec100b",
        "size_bytes": 2680
      }
    },
    {
      "dependency_id": "swu-tsgr-003-closeout-preflight",
      "artifact_ref": {
        "path": "arcanum/arcana/task-session/development/invoke-runs/20260730T170810Z-deterministic-governance-runner/refreshes/20260730T202200Z-swu-tsgr-003-producer/task-session-review/CLOSEOUT-PREFLIGHT.json",
        "sha256": "6d3ce08c8958be58ec6543614f31292fc1e47908e7b8edc2fc783e4f0cd2f56c",
        "size_bytes": 3624
      }
    }
  ],
  "mirror_groups": [],
  "approval": {
    "class": "explicit-apply",
    "owner": "invoke",
    "scope_paths": [
      "arcanum/arcana/task-session/development/invoke-runs/20260730T170810Z-deterministic-governance-runner/WORK-PACK.md",
      "arcanum/arcana/task-session/development/invoke-runs/20260730T170810Z-deterministic-governance-runner/work-pack/tasks/TASK-TSGR-02-RUNNER.md",
      "arcanum/arcana/task-session/development/invoke-runs/20260730T170810Z-deterministic-governance-runner/work-pack/waves/W1-RUNNER-MECHANISM.md",
      "arcanum/arcana/task-session/development/invoke-runs/20260730T170810Z-deterministic-governance-runner/CONTINUATION.json"
    ],
    "authority_classes": [
      "public"
    ],
    "publication_classes": [
      "public"
    ]
  },
  "validation_commands": [
    "python3 validate-plan-package.py .",
    "python3 -m json.tool CONTINUATION.json"
  ]
}
