{
  "approval": {
    "authority_classes": [
      "public"
    ],
    "class": "explicit-apply",
    "owner": "spellcraft",
    "publication_classes": [
      "public"
    ],
    "scope_paths": [
      "spells/goal/development/decision-frontier-experiment/runtime/hitl.py",
      "spells/goal/development/decision-frontier-experiment/fixtures/hitl-map.json",
      "spells/goal/development/decision-frontier-experiment/fixtures/expected/hitl-route.json",
      "spells/goal/development/decision-frontier-experiment/scripts/run_hitl_fixture.py"
    ]
  },
  "authority_class": "public",
  "changes": [
    {
      "operation": "create",
      "output_ref": {
        "path": "spells/goal/development/invoke-runs/20260730T171428Z-decision-frontier-experiment/refresh-runs/20260730T182631Z-runtime-admission-refresh/material-packages/SWU-DFE-005/staged/spells/goal/development/decision-frontier-experiment/runtime/hitl.py",
        "sha256": "860d30d378f8e38381fe86ab60f5581cbc0240e61468461f957847330a616faf",
        "size_bytes": 1105
      },
      "target_path": "spells/goal/development/decision-frontier-experiment/runtime/hitl.py"
    },
    {
      "operation": "create",
      "output_ref": {
        "path": "spells/goal/development/invoke-runs/20260730T171428Z-decision-frontier-experiment/refresh-runs/20260730T182631Z-runtime-admission-refresh/material-packages/SWU-DFE-005/staged/spells/goal/development/decision-frontier-experiment/fixtures/hitl-map.json",
        "sha256": "7e19f37a920432c3cd0662670c464fb617f90eef4a62e480d44fa71cbb7e19d5",
        "size_bytes": 407
      },
      "target_path": "spells/goal/development/decision-frontier-experiment/fixtures/hitl-map.json"
    },
    {
      "operation": "create",
      "output_ref": {
        "path": "spells/goal/development/invoke-runs/20260730T171428Z-decision-frontier-experiment/refresh-runs/20260730T182631Z-runtime-admission-refresh/material-packages/SWU-DFE-005/staged/spells/goal/development/decision-frontier-experiment/fixtures/expected/hitl-route.json",
        "sha256": "b7e37bde9dc1eac8accc0ff419b7fd3b27ffde359eadbf77c1ed42d637459435",
        "size_bytes": 269
      },
      "target_path": "spells/goal/development/decision-frontier-experiment/fixtures/expected/hitl-route.json"
    },
    {
      "operation": "create",
      "output_ref": {
        "path": "spells/goal/development/invoke-runs/20260730T171428Z-decision-frontier-experiment/refresh-runs/20260730T182631Z-runtime-admission-refresh/material-packages/SWU-DFE-005/staged/spells/goal/development/decision-frontier-experiment/scripts/run_hitl_fixture.py",
        "sha256": "15b7ee78caca60109408af86d402a359958317c04eafb4ba9101d59cecfc1077",
        "size_bytes": 1485
      },
      "target_path": "spells/goal/development/decision-frontier-experiment/scripts/run_hitl_fixture.py"
    }
  ],
  "dependencies": [
    {
      "artifact_ref": {
        "path": "spells/goal/development/decision-frontier-experiment/session-evidence/SWU-DFE-004/owner-receipt.json",
        "sha256": "111c853ee56a643b2de44ea1fdd31688d0daaf874477d707519738673b2a65ee",
        "size_bytes": 2263
      },
      "dependency_id": "SWU-DFE-004"
    }
  ],
  "lifecycle_owner": "spellcraft",
  "mirror_groups": [],
  "mutation_mode": "apply-approved",
  "mutation_state": "materialized",
  "package_id": "goal-dfe-swu-dfe-005",
  "publication_class": "public",
  "schema_version": "1.0.0",
  "source_artifacts": [
    {
      "authority_class": "public",
      "path": "spells/goal/development/invoke-runs/20260730T171428Z-decision-frontier-experiment/work-pack/tasks/TASK-DFE-BOUNDARY.md",
      "sha256": "869749c5c954982f721382be775144ced3902f5210d64f86ac12c1ecffe3a763",
      "size_bytes": 7045
    },
    {
      "authority_class": "public",
      "path": "spells/goal/development/invoke-runs/20260730T171428Z-decision-frontier-experiment/WORK-PACK.md",
      "sha256": "2f0452079561df50a0e573f005abc09a060fac45dcf463d8cc0c42896cbd6d3e",
      "size_bytes": 7430
    },
    {
      "authority_class": "public",
      "path": "spells/goal/development/invoke-runs/20260730T171428Z-decision-frontier-experiment/work-pack/shared/CONTEXT.md",
      "sha256": "7852aabf39a81888498c3d86e9e29459f0b8ab603e6b973e753bb95b67fe382a",
      "size_bytes": 813
    },
    {
      "authority_class": "public",
      "path": "spells/goal/development/invoke-runs/20260730T171428Z-decision-frontier-experiment/SPELLCRAFT-ADMISSION-RECEIPT.json",
      "sha256": "592e7b285848e594a47a23ef78bf5dd34033e75fb85ef0d4a2d8dde36c36e9f2",
      "size_bytes": 1806
    },
    {
      "authority_class": "public",
      "path": "spells/goal/development/invoke-runs/20260730T171428Z-decision-frontier-experiment/execution-control/SWU-DFE-005/CONTEXT-PACK.json",
      "sha256": "174a7da6ee1e7e87aee63f523f6fb74350466becc8ecee02c06f8723969166fe",
      "size_bytes": 5413
    }
  ],
  "target_inventory": [
    {
      "authority_class": "public",
      "dependency_ids": [
        "SWU-DFE-004"
      ],
      "lifecycle_owner": "spellcraft",
      "publication_class": "public",
      "target_path": "spells/goal/development/decision-frontier-experiment/runtime/hitl.py"
    },
    {
      "authority_class": "public",
      "dependency_ids": [
        "SWU-DFE-004"
      ],
      "lifecycle_owner": "spellcraft",
      "publication_class": "public",
      "target_path": "spells/goal/development/decision-frontier-experiment/fixtures/hitl-map.json"
    },
    {
      "authority_class": "public",
      "dependency_ids": [
        "SWU-DFE-004"
      ],
      "lifecycle_owner": "spellcraft",
      "publication_class": "public",
      "target_path": "spells/goal/development/decision-frontier-experiment/fixtures/expected/hitl-route.json"
    },
    {
      "authority_class": "public",
      "dependency_ids": [
        "SWU-DFE-004"
      ],
      "lifecycle_owner": "spellcraft",
      "publication_class": "public",
      "target_path": "spells/goal/development/decision-frontier-experiment/scripts/run_hitl_fixture.py"
    }
  ],
  "validation_commands": [
    "python3 goal/development/decision-frontier-experiment/scripts/run_hitl_fixture.py"
  ]
}
