{
  "schema_version": "1.0.0",
  "package_id": "swu-tsgr-005-reconcile-v1",
  "mutation_mode": "apply-approved",
  "mutation_state": "materialized",
  "lifecycle_owner": "sigil-development",
  "authority_class": "public",
  "publication_class": "public",
  "source_artifacts": [
    {
      "path": "arcanum/arcana/task-session/development/invoke-runs/20260730T170810Z-deterministic-governance-runner/WORK-PACK.md",
      "sha256": "7aca9622522712a942af7cfae576a7480b3dd5ee25a431806c20f5533bb42a1f",
      "size_bytes": 9459,
      "authority_class": "public"
    },
    {
      "path": "arcanum/arcana/task-session/development/invoke-runs/20260730T170810Z-deterministic-governance-runner/work-pack/tasks/TASK-TSGR-02-RUNNER.md",
      "sha256": "f6e95c0ba2bfee4f0dac25fb2e69f2e837d698721ea0e86a6a0c39e30ee29eef",
      "size_bytes": 3444,
      "authority_class": "public"
    },
    {
      "path": "arcanum/arcana/task-session/development/invoke-runs/20260730T170810Z-deterministic-governance-runner/refreshes/20260730T211000Z-swu-tsgr-005-producer/task-session-apply/CONTEXT-PACK.json",
      "sha256": "716b35d129ff618d6a132438e8b41ecf1167520294762cb142a63103a42156b6",
      "size_bytes": 4178,
      "authority_class": "public"
    },
    {
      "path": "arcanum/arcana/task-session/development/invoke-runs/20260730T170810Z-deterministic-governance-runner/CONTINUATION.json",
      "sha256": "a6edbee878de94ddeeb9411e2169f527e341d5dfe7a5de4d1f69a36b4045850e",
      "size_bytes": 1050,
      "authority_class": "public"
    }
  ],
  "changes": [
    {
      "target_path": "arcanum/arcana/task-session/scripts/task-session-governance-runner.py",
      "operation": "update",
      "output_ref": {
        "path": "arcanum/arcana/task-session/development/invoke-runs/20260730T170810Z-deterministic-governance-runner/refreshes/20260730T211000Z-swu-tsgr-005-producer/producer/staged/arcanum/arcana/task-session/scripts/task-session-governance-runner.py",
        "sha256": "d64b2f81b0921eb0a7348c8f23f95ca7eac47228f573ff2251ea36e008ad4d23",
        "size_bytes": 41572
      }
    },
    {
      "target_path": "arcanum/arcana/task-session/development/fixtures/governance-runner-cases.json",
      "operation": "update",
      "output_ref": {
        "path": "arcanum/arcana/task-session/development/invoke-runs/20260730T170810Z-deterministic-governance-runner/refreshes/20260730T211000Z-swu-tsgr-005-producer/producer/staged/arcanum/arcana/task-session/development/fixtures/governance-runner-cases.json",
        "sha256": "fd311527f869432283af6654b3be2159563252e0b9ecc9923578484c4b545471",
        "size_bytes": 6489
      }
    },
    {
      "target_path": "arcanum/arcana/task-session/development/validate-governance-runner.py",
      "operation": "update",
      "output_ref": {
        "path": "arcanum/arcana/task-session/development/invoke-runs/20260730T170810Z-deterministic-governance-runner/refreshes/20260730T211000Z-swu-tsgr-005-producer/producer/staged/arcanum/arcana/task-session/development/validate-governance-runner.py",
        "sha256": "52456a262faeb43646b7c4cf6e93aa476c7232cc62536b0ea76c147f3d16e83d",
        "size_bytes": 49904
      }
    }
  ],
  "target_inventory": [
    {
      "target_path": "arcanum/arcana/task-session/scripts/task-session-governance-runner.py",
      "lifecycle_owner": "sigil-development",
      "authority_class": "public",
      "publication_class": "public",
      "dependency_ids": [
        "swu-tsgr-004-terminal-result",
        "swu-tsgr-004-closeout-owner",
        "swu-tsgr-005-material-producer"
      ]
    },
    {
      "target_path": "arcanum/arcana/task-session/development/fixtures/governance-runner-cases.json",
      "lifecycle_owner": "sigil-development",
      "authority_class": "public",
      "publication_class": "public",
      "dependency_ids": [
        "swu-tsgr-004-terminal-result",
        "swu-tsgr-004-closeout-owner",
        "swu-tsgr-005-material-producer"
      ]
    },
    {
      "target_path": "arcanum/arcana/task-session/development/validate-governance-runner.py",
      "lifecycle_owner": "sigil-development",
      "authority_class": "public",
      "publication_class": "public",
      "dependency_ids": [
        "swu-tsgr-004-terminal-result",
        "swu-tsgr-004-closeout-owner",
        "swu-tsgr-005-material-producer"
      ]
    }
  ],
  "dependencies": [
    {
      "dependency_id": "swu-tsgr-004-terminal-result",
      "artifact_ref": {
        "path": "arcanum/arcana/task-session/development/invoke-runs/20260730T170810Z-deterministic-governance-runner/work-pack/results/SWU-TSGR-004-RESULT.json",
        "sha256": "b85ae6c05af69b17929685abd86b814751f120c3916b07e9aaa8c04c24231cdf",
        "size_bytes": 2922
      }
    },
    {
      "dependency_id": "swu-tsgr-004-closeout-owner",
      "artifact_ref": {
        "path": "arcanum/arcana/task-session/development/invoke-runs/20260730T170810Z-deterministic-governance-runner/work-pack/closeout/SWU-TSGR-004-CONTINUATION-OWNER-RECEIPT.json",
        "sha256": "d8e23f2e4378b73e4593c5ef2a14fb7b1b4597dad4c495c50f28d2c30e8e55cc",
        "size_bytes": 1209
      }
    },
    {
      "dependency_id": "swu-tsgr-005-material-producer",
      "artifact_ref": {
        "path": "arcanum/arcana/task-session/development/invoke-runs/20260730T170810Z-deterministic-governance-runner/refreshes/20260730T211000Z-swu-tsgr-005-producer/producer/material-producer-receipt.json",
        "sha256": "72c883aa3497d7b0ccf7a5f2059c7eaae17ed99be8b170889621f44571823406",
        "size_bytes": 11335
      }
    }
  ],
  "mirror_groups": [],
  "approval": {
    "class": "explicit-apply",
    "owner": "sigil-development",
    "scope_paths": [
      "arcanum/arcana/task-session/scripts/task-session-governance-runner.py",
      "arcanum/arcana/task-session/development/fixtures/governance-runner-cases.json",
      "arcanum/arcana/task-session/development/validate-governance-runner.py"
    ],
    "authority_classes": [
      "public"
    ],
    "publication_classes": [
      "public"
    ]
  },
  "validation_commands": [
    "python3 arcana/task-session/development/validate-governance-runner.py --family reconcile"
  ]
}
